name	value	description
hadoop.http.cross-origin.enabled	false	Enable/disable the cross-origin (CORS) filter.
hadoop.http.cross-origin.allowed-origins	*	Comma separated list of origins that are allowed for web services needing cross-origin (CORS) support. Wildcards (*) and patterns allowed
hadoop.http.cross-origin.allowed-methods	GET,POST,HEAD	Comma separated list of methods that are allowed for web services needing cross-origin (CORS) support.
hadoop.http.cross-origin.allowed-headers	X-Requested-With,Content-Type,Accept,Origin	Comma separated list of headers that are allowed for web services needing cross-origin (CORS) support.
hadoop.http.cross-origin.max-age	1800	The number of seconds a pre-flighted request can be cached for web services needing cross-origin (CORS) support.
dfs.ha.fencing.methods		List of fencing methods to use for service fencing. May contain builtin methods (eg shell and sshfence) or user-defined method.
dfs.ha.fencing.ssh.connect-timeout	30000	SSH connection timeout, in milliseconds, to use with the builtin sshfence fencer.
dfs.ha.fencing.ssh.private-key-files		The SSH private key files to use with the builtin sshfence fencer.
hadoop.http.staticuser.user	dr.who	The user name to filter as, on static web filters while rendering content. An example use is the HDFS web UI (user to be used for browsing files).
ha.zookeeper.quorum		A list of ZooKeeper server addresses, separated by commas, that are to be used by the ZKFailoverController in automatic failover.
ha.zookeeper.session-timeout.ms	5000	The session timeout to use when the ZKFC connects to ZooKeeper. Setting this value to a lower value implies that server crashes will be detected more quickly, but risks triggering failover too aggressively in the case of a transient error or network blip.
ha.zookeeper.parent-znode	/hadoop-ha	The ZooKeeper znode under which the ZK failover controller stores its information. Note that the nameservice ID is automatically appended to this znode, so it is not normally necessary to configure this, even in a federated environment.
ha.zookeeper.acl	world:anyone:rwcda	A comma-separated list of ZooKeeper ACLs to apply to the znodes used by automatic failover. These ACLs are specified in the same format as used by the ZooKeeper CLI. If the ACL itself contains secrets, you may instead specify a path to a file, prefixed with the '@' symbol, and the value of this configuration will be loaded from within.
ha.zookeeper.auth		A comma-separated list of ZooKeeper authentications to add when connecting to ZooKeeper. These are specified in the same format as used by the "addauth" command in the ZK CLI. It is important that the authentications specified here are sufficient to access znodes with the ACL specified in ha.zookeeper.acl. If the auths contain secrets, you may instead specify a path to a file, prefixed with the '@' symbol, and the value of this configuration will be loaded from within.
hadoop.ssl.keystores.factory.class	org.apache.hadoop.security.ssl.FileBasedKeyStoresFactory	The keystores factory to use for retrieving certificates.
hadoop.ssl.require.client.cert	false	Whether client certificates are required
hadoop.ssl.hostname.verifier	DEFAULT	The hostname verifier to provide for HttpsURLConnections. Valid values are: DEFAULT, STRICT, STRICT_I6, DEFAULT_AND_LOCALHOST and ALLOW_ALL
hadoop.ssl.server.conf	ssl-server.xml	Resource file from which ssl server keystore information will be extracted. This file is looked up in the classpath, typically it should be in Hadoop conf/ directory.
hadoop.ssl.client.conf	ssl-client.xml	Resource file from which ssl client keystore information will be extracted This file is looked up in the classpath, typically it should be in Hadoop conf/ directory.
hadoop.ssl.enabled	false	Deprecated. Use dfs.http.policy and yarn.http.policy instead.
hadoop.ssl.enabled.protocols	TLSv1	Protocols supported by the ssl.
hadoop.jetty.logs.serve.aliases	true	Enable/Disable aliases serving from jetty
fs.permissions.umask-mode	022	The umask used when creating files and directories. Can be in octal or in symbolic. Examples are: "022" (octal for u=rwx,g=r-x,o=r-x in symbolic), or "u=rwx,g=rwx,o=" (symbolic for 007 in octal).
ha.health-monitor.connect-retry-interval.ms	1000	How often to retry connecting to the service.
ha.health-monitor.check-interval.ms	1000	How often to check the service.
ha.health-monitor.sleep-after-disconnect.ms	1000	How long to sleep after an unexpected RPC error.
ha.health-monitor.rpc-timeout.ms	45000	Timeout for the actual monitorHealth() calls.
ha.failover-controller.new-active.rpc-timeout.ms	60000	Timeout that the FC waits for the new active to become active
ha.failover-controller.graceful-fence.rpc-timeout.ms	5000	Timeout that the FC waits for the old active to go to standby
ha.failover-controller.graceful-fence.connection.retries	1	FC connection retries for graceful fencing
ha.failover-controller.cli-check.rpc-timeout.ms	20000	Timeout that the CLI (manual) FC waits for monitorHealth, getServiceState
ipc.client.fallback-to-simple-auth-allowed	false	When a client is configured to attempt a secure connection, but attempts to connect to an insecure server, that server may instruct the client to switch to SASL SIMPLE (unsecure) authentication. This setting controls whether or not the client will accept this instruction from the server. When false (the default), the client will not allow the fallback to SIMPLE authentication, and will abort the connection.
fs.client.resolve.remote.symlinks	true	Whether to resolve symlinks when accessing a remote Hadoop filesystem. Setting this to false causes an exception to be thrown upon encountering a symlink. This setting does not apply to local filesystems, which automatically resolve local symlinks.
nfs.exports.allowed.hosts	* rw	By default, the export can be mounted by any client. The value string contains machine name and access privilege, separated by whitespace characters. The machine name format can be a single host, a Java regular expression, or an IPv4 address. The access privilege uses rw or ro to specify read/write or read-only access of the machines to exports. If the access privilege is not provided, the default is read-only. Entries are separated by ";". For example: "192.168.0.0/22 rw ; host.*\.example\.com ; host1.test.org ro;". Only the NFS gateway needs to restart after this property is updated.
hadoop.user.group.static.mapping.overrides	dr.who=;	Static mapping of user to groups. This will override the groups if available in the system for the specified user. In otherwords, groups look-up will not happen for these users, instead groups mapped in this configuration will be used. Mapping should be in this format. user1=group1,group2;user2=;user3=group2; Default, "dr.who=;" will consider "dr.who" as user without groups.
rpc.metrics.quantile.enable	false	Setting this property to true and rpc.metrics.percentiles.intervals to a comma-separated list of the granularity in seconds, the 50/75/90/95/99th percentile latency for rpc queue/processing time in milliseconds are added to rpc metrics.
rpc.metrics.percentiles.intervals		A comma-separated list of the granularity in seconds for the metrics which describe the 50/75/90/95/99th percentile latency for rpc queue/processing time. The metrics are outputted if rpc.metrics.quantile.enable is set to true.
hadoop.security.crypto.codec.classes.EXAMPLECIPHERSUITE		The prefix for a given crypto codec, contains a comma-separated list of implementation classes for a given crypto codec (eg EXAMPLECIPHERSUITE). The first implementation will be used if available, others are fallbacks.
hadoop.security.crypto.codec.classes.aes.ctr.nopadding	org.apache.hadoop.crypto.OpensslAesCtrCryptoCodec,org.apache.hadoop.crypto.JceAesCtrCryptoCodec	Comma-separated list of crypto codec implementations for AES/CTR/NoPadding. The first implementation will be used if available, others are fallbacks.
hadoop.security.crypto.cipher.suite	AES/CTR/NoPadding	Cipher suite for crypto codec.
hadoop.security.crypto.jce.provider		The JCE provider name used in CryptoCodec.
hadoop.security.crypto.buffer.size	8192	The buffer size used by CryptoInputStream and CryptoOutputStream.
hadoop.security.java.secure.random.algorithm	SHA1PRNG	The java secure random algorithm.
hadoop.security.secure.random.impl		Implementation of secure random.
hadoop.security.random.device.file.path	/dev/urandom	OS security random device file path.
fs.har.impl.disable.cache	true	Don't cache 'har' filesystem instances.
hadoop.security.kms.client.authentication.retry-count	1	Number of time to retry connecting to KMS on authentication failure
hadoop.security.kms.client.encrypted.key.cache.size	500	Size of the EncryptedKeyVersion cache Queue for each key
hadoop.security.kms.client.encrypted.key.cache.low-watermark	0.3f	If size of the EncryptedKeyVersion cache Queue falls below the low watermark, this cache queue will be scheduled for a refill
hadoop.security.kms.client.encrypted.key.cache.num.refill.threads	2	Number of threads to use for refilling depleted EncryptedKeyVersion cache Queues
hadoop.security.kms.client.encrypted.key.cache.expiry	43200000	Cache expiry time for a Key, after which the cache Queue for this key will be dropped. Default = 12hrs
hadoop.htrace.spanreceiver.classes		A comma separated list of the fully-qualified class name of classes implementing SpanReceiver. The tracing system works by collecting information in structs called 'Spans'. It is up to you to choose how you want to receive this information by implementing the SpanReceiver interface.
ipc.server.max.connections	0	The maximum number of concurrent connections a server is allowed to accept. If this limit is exceeded, incoming connections will first fill the listen queue and then may go to an OS-specific listen overflow queue. The client may fail or timeout, but the server can avoid running out of file descriptors using this feature. 0 means no limit.
hadoop.registry.rm.enabled	false	Is the registry enabled in the YARN Resource Manager? If true, the YARN RM will, as needed. create the user and system paths, and purge service records when containers, application attempts and applications complete. If false, the paths must be created by other means, and no automatic cleanup of service records will take place.
hadoop.registry.zk.root	/registry	The root zookeeper node for the registry
hadoop.registry.zk.session.timeout.ms	60000	Zookeeper session timeout in milliseconds
hadoop.registry.zk.connection.timeout.ms	15000	Zookeeper connection timeout in milliseconds
hadoop.registry.zk.retry.times	5	Zookeeper connection retry count before failing
hadoop.registry.zk.retry.interval.ms	1000	
hadoop.registry.zk.retry.ceiling.ms	60000	Zookeeper retry limit in milliseconds, during exponential backoff. This places a limit even if the retry times and interval limit, combined with the backoff policy, result in a long retry period
hadoop.registry.zk.quorum	localhost:2181	List of hostname:port pairs defining the zookeeper quorum binding for the registry
hadoop.registry.secure	false	Key to set if the registry is secure. Turning it on changes the permissions policy from "open access" to restrictions on kerberos with the option of a user adding one or more auth key pairs down their own tree.
hadoop.registry.system.acls	sasl:yarn@, sasl:mapred@, sasl:hdfs@	A comma separated list of Zookeeper ACL identifiers with system access to the registry in a secure cluster. These are given full access to all entries. If there is an "@" at the end of a SASL entry it instructs the registry client to append the default kerberos domain.
hadoop.registry.kerberos.realm		The kerberos realm: used to set the realm of system principals which do not declare their realm, and any other accounts that need the value. If empty, the default realm of the running process is used. If neither are known and the realm is needed, then the registry service/client will fail.
hadoop.registry.jaas.context	Client	Key to define the JAAS context. Used in secure mode